A1: âÒêîÉJÉCÉXÉE | B1: ìnÁ≤ ëèék | C1: òeç‚ ómóS | D1: ïΩñÿ óIëæ | E1: çÇã¥ òaç∆ | F1: îº‡V åÂ | G1: ä÷ç™ âÎóm | H1: èº‡V çÑ | I1: ëOìc óYç∆ | J1: òeç‚ òaçG | K1: ç≤í| åÂ
A2: 1 | B2: 5.0706018518518526E-4 | C2: 5.4074074074074072E-4 | D2: 5.0289351851851851E-4 | E2: 5.3009259259259253E-4 | F2: 4.4374999999999997E-4 | G2: 5.6736111111111115E-4 | H2: 5.3171296296296289E-4 | I2: 4.9849537037037039E-4 | J2: 5.4583333333333328E-4 | K2: 4.9189814814814821E-4
A3: 2 | B3: 5.0034722222222223E-4 | C3: 5.5370370370370371E-4 | D3: 5.0740740740740748E-4 | E3: 5.3761574074074074E-4 | F3: 4.3263888888888887E-4 | G3: 5.8738425925925928E-4 | H3: 5.6481481481481476E-4 | I3: 5.5648148148148148E-4 | J3: 5.90625E-4 | K3: 5.1620370370370372E-4
A4: 3 | B4: 5.175925925925926E-4 | C4: 5.5289351851851853E-4 | D4: 5.3333333333333336E-4 | E4: 5.3217592592592585E-4 | F4: 4.3240740740740745E-4 | G4: 5.7893518518518515E-4 | H4: 5.7071759259259261E-4 | I4: 5.7951388888888885E-4 | J4: 5.912037037037037E-4 | K4: 5.3125000000000004E-4
A5: 4 | B5: 5.3090277777777782E-4 | C5: 5.6527777777777783E-4 | D5: 5.3715277777777778E-4 | E5: 5.4861111111111104E-4 | F5: 4.3043981481481487E-4 | G5: 5.2280092592592591E-4 | H5: 6.0497685185185188E-4 | I5: 5.8391203703703708E-4 | J5: 6.0324074074074067E-4 | K5: 5.4675925925925931E-4
A6: 5 | B6: 5.3912037037037036E-4 | C6: 5.3969907407407406E-4 | D6: 5.3101851851851856E-4 | E6: 5.4583333333333328E-4 | F6: 4.3750000000000001E-4 | G6: 5.2233796296296306E-4 | H6: 5.9432870370370369E-4 | I6: 5.6724537037037041E-4 | J6: 5.9224537037037036E-4 | K6: 5.5625E-4
A7: 6 | B7: 5.3530092592592594E-4 | C7: 5.4259259259259256E-4 | D7: 5.1979166666666656E-4 | E7: 5.2187500000000009E-4 | F7: 4.3750000000000001E-4 | G7: 6.0011574074074069E-4 | H7: 6.197916666666666E-4 | I7: 6.2349537037037028E-4 | J7: 6.197916666666666E-4 | K7: 5.7939814814814822E-4
A8: 7 | B8: 5.6990740740740743E-4 | C8: 5.7199074074074075E-4 | D8: 5.4062499999999998E-4 | E8: 5.4629629629629635E-4 | F8: 4.3263888888888887E-4 | G8: 5.9027777777777778E-4 | H8: 6.333333333333333E-4 | I8: 5.8981481481481482E-4 | J8: 6.2280092592592595E-4 | K8: 5.9027777777777778E-4
A9: 8 | B9: 5.5844907407407416E-4 | C9: 5.6331018518518525E-4 | D9: 5.3043981481481475E-4 | E9: 5.2083333333333333E-4 | F9: 4.3842592592592593E-4 | G9: 5.9699074074074071E-4 | H9: 6.3240740740740738E-4 | I9: 5.8912037037037038E-4 | J9: 6.3923611111111115E-4 | K9: 6.1458333333333341E-4
A10: 9 | B10: 5.5775462962962951E-4 | C10: 5.5069444444444436E-4 | D10: 5.4074074074074072E-4 | E10: 5.2650462962962959E-4 | F10: 4.4293981481481485E-4 | G10: 5.5439814814814815E-4 | H10: 6.3148148148148146E-4 | I10: 5.8634259259259251E-4 | J10: 6.7812500000000002E-4 | K10: 6.1064814814814814E-4
A11: 10 | B11: 5.5219907407407409E-4 | C11: 5.5289351851851853E-4 | D11: 5.2905092592592598E-4 | E11: 5.3611111111111112E-4 | F11: 4.3773148148148143E-4 | G11: 5.2037037037037037E-4 | H11: 6.3252314814814812E-4 | I11: 5.7650462962962961E-4 | J11: 6.2893518518518517E-4 | K11: 6.0625000000000002E-4
A12: 11 | B12: 5.5763888888888888E-4 | C12: 5.6331018518518525E-4 | D12: 5.4189814814814812E-4 | E12: 5.380787037037037E-4 | F12: 4.4212962962962961E-4 | G12: 5.1273148148148141E-4 | H12: 6.1863425925925931E-4 | I12: 5.9282407407407406E-4 | J12: 6.281250000000001E-4 | K12: 6.1180555555555554E-4
A13: 12 | B13: 5.568287037037037E-4 | C13: 5.8379629629629634E-4 | D13: 5.4502314814814821E-4 | E13: 5.6180555555555552E-4 | F13: 4.5138888888888892E-4 | G13: 5.1064814814814809E-4 | H13: 6.3148148148148146E-4 | I13: 5.9907407407407403E-4 | J13: 6.2962962962962961E-4 | K13: 6.0972222222222222E-4
A14: 13 | B14: 5.5185185185185187E-4 | C14: 5.5937499999999998E-4 | D14: 5.5173611111111113E-4 | E14: 5.4120370370370368E-4 | F14: 4.3981481481481481E-4 | G14: 5.3125000000000004E-4 | H14: 6.0925925925925926E-4 | I14: 6.0925925925925926E-4 | J14: 6.3124999999999998E-4 | K14: 6.1851851851851846E-4
A15: 14 | B15: 5.5706018518518518E-4 | C15: 5.7523148148148147E-4 | D15: 5.461805555555555E-4 | E15: 5.5763888888888888E-4 | F15: 4.4803240740740741E-4 | G15: 5.5497685185185185E-4 | H15: 6.1550925925925922E-4 | I15: 5.9814814814814811E-4 | J15: 6.3310185185185192E-4 | K15: 6.0486111111111114E-4
A16: 15 | B16: 5.5983796296296294E-4 | C16: 5.7060185185185187E-4 | D16: 5.5069444444444436E-4 | E16: 5.4131944444444453E-4 | F16: 4.6736111111111116E-4 | G16: 5.9247685185185184E-4 | H16: 6.2569444444444445E-4 | I16: 6.0983796296296296E-4 | J16: 6.590277777777778E-4 | K16: 6.1805555555555561E-4
A17: 16 | B17: 5.5960648148148156E-4 | C17: 5.5613425925925926E-4 | D17: 5.415509259259259E-4 | E17: 5.5104166666666659E-4 | F17: 4.4513888888888885E-4 | G17: 5.9363425925925925E-4 | H17: 6.1319444444444431E-4 | I17: 6.1319444444444431E-4 | J17: 6.3194444444444442E-4 | K17: 6.1446759259259256E-4
A18: 17 | B18: 5.7905092592592589E-4 | C18: 5.6793981481481485E-4 | D18: 5.4629629629629635E-4 | E18: 5.5162037037037029E-4 | F18: 4.6539351851851858E-4 | G18: 6.0613425925925917E-4 | H18: 6.0509259259259262E-4 | I18: 6.3136574074074061E-4 | J18: 6.2939814814814813E-4 | K18: 6.2268518518518521E-4
A19: 18 | B19: 5.7256944444444445E-4 | C19: 5.5405092592592583E-4 | D19: 5.6053240740740749E-4 | E19: 5.4687500000000005E-4 | F19: 4.7037037037037034E-4 | G19: 6.2002314814814819E-4 | H19: 6.0648148148148139E-4 | I19: 6.1967592592592597E-4 | J19: 6.5057870370370367E-4 | K19: 6.2002314814814819E-4
A20: 19 | B20: 5.7361111111111122E-4 | C20: 5.4282407407407404E-4 | D20: 5.5162037037037029E-4 | E20: 5.4282407407407404E-4 | F20: 4.6087962962962961E-4 | G20: 6.3437500000000006E-4 | H20: 5.9525462962962961E-4 | I20: 6.4062500000000003E-4 | J20: 6.495370370370369E-4 | K20: 6.1249999999999998E-4
A21: 20 | B21: 5.7858796296296293E-4 | C21: 5.4641203703703709E-4 | D21: 5.5648148148148148E-4 | E21: 5.4201388888888886E-4 | F21: 4.7800925925925919E-4 | G21: 6.5254629629629636E-4 | H21: 6.0960648148148148E-4 | I21: 6.3194444444444442E-4 | J21: 6.6319444444444444E-4 | K21: 6.1539351851851848E-4
A22: 21 | B22: 5.5995370370370368E-4 | C22: 5.5601851851851852E-4 | D22: 5.473379629629629E-4 | E22: 5.3900462962962962E-4 | F22: 4.7928240740740738E-4 | G22: 6.4143518518518521E-4 | H22: 6.2835648148148137E-4 | I22: 6.5173611111111118E-4 | J22: 6.4791666666666665E-4 | K22: Å@
A23: 22 | B23: 5.8414351851851845E-4 | C23: 5.585648148148148E-4 | D23: 5.6562500000000005E-4 | E23: 5.4722222222222227E-4 | F23: 4.7835648148148146E-4 | G23: 6.3576388888888895E-4 | H23: 6.1574074074074081E-4 | I23: 6.5462962962962957E-4 | J23: 6.5578703703703708E-4 | K23: Å@
A24: 23 | B24: 5.8506944444444437E-4 | C24: 5.6620370370370375E-4 | D24: 5.6226851851851848E-4 | E24: 5.4988425925925918E-4 | F24: 4.8032407407407404E-4 | G24: 6.3622685185185191E-4 | H24: 6.2129629629629622E-4 | I24: 6.6990740740740737E-4 | J24: 6.7824074074074065E-4 | K24: Å@
A25: 24 | B25: Å@ | C25: 5.6944444444444447E-4 | D25: 5.579861111111111E-4 | E25: 5.5486111111111111E-4 | F25: 4.8113425925925922E-4 | G25: 6.2106481481481485E-4 | H25: 6.197916666666666E-4 | I25: 6.5694444444444437E-4 | J25: 6.7546296296296289E-4 | K25: Å@
A26: 25 | B26: 5.8206018518518513E-4 | C26: 5.5590277777777778E-4 | D26: 5.7337962962962963E-4 | E26: 5.3946759259259258E-4 | F26: 4.7812500000000003E-4 | G26: 6.3483796296296302E-4 | H26: 6.2592592592592593E-4 | I26: 6.7650462962962966E-4 | J26: 6.6400462962962952E-4 | K26: Å@
A27: 26 | B27: 5.8715277777777769E-4 | C27: 5.7858796296296293E-4 | D27: 5.7499999999999999E-4 | E27: 5.5555555555555556E-4 | F27: 4.9409722222222216E-4 | G27: 6.2152777777777781E-4 | H27: 6.2951388888888887E-4 | I27: 6.8900462962962958E-4 | J27: 6.7696759259259262E-4 | K27: Å@
A28: 27 | B28: 5.7465277777777777E-4 | C28: 5.7812499999999997E-4 | D28: 5.7245370370370371E-4 | E28: 5.5590277777777778E-4 | F28: 4.9733796296296299E-4 | G28: 6.0520833333333336E-4 | H28: 6.1504629629629637E-4 | I28: 6.3946759259259263E-4 | J28: 6.4097222222222225E-4 | K28: Å@
A29: 28 | B29: 5.8912037037037038E-4 | C29: 5.7951388888888885E-4 | D29: 5.7800925925925923E-4 | E29: 5.4340277777777785E-4 | F29: 4.9641203703703707E-4 | G29: 6.1886574074074068E-4 | H29: 6.3576388888888895E-4 | I29: 6.6574074074074072E-4 | J29: 6.7511574074074078E-4 | K29: Å@
A30: 29 | B30: 5.7476851851851851E-4 | C30: 5.7025462962962965E-4 | D30: 5.9085648148148148E-4 | E30: 5.2847222222222217E-4 | F30: 5.0243055555555555E-4 | G30: 5.6180555555555552E-4 | H30: 6.2465277777777768E-4 | I30: 6.6493055555555565E-4 | J30: 6.9479166666666658E-4 | K30: Å@
A31: 30 | B31: 6.0115740740740735E-4 | C31: 5.7395833333333333E-4 | D31: 5.8576388888888892E-4 | E31: 5.3726851851851863E-4 | F31: 5.0752314814814811E-4 | G31: 5.7280092592592593E-4 | H31: 5.9039351851851852E-4 | I31: 6.5949074074074076E-4 | J31: 7.1990740740740739E-4 | K31: Å@
A32: 31 | B32: 5.7025462962962965E-4 | C32: 5.6388888888888884E-4 | D32: 5.7638888888888887E-4 | E32: 5.2349537037037024E-4 | F32: 5.1145833333333327E-4 | G32: 5.5034722222222214E-4 | H32: 6.2164351851851855E-4 | I32: 6.5590277777777782E-4 | J32: 6.7847222222222224E-4 | K32: Å@
A33: 32 | B33: 5.8182870370370376E-4 | C33: 5.6400462962962958E-4 | D33: 5.9282407407407406E-4 | E33: 5.3043981481481475E-4 | F33: 5.0358796296296295E-4 | G33: 5.5844907407407416E-4 | H33: 6.3113425925925934E-4 | I33: 6.5428240740740735E-4 | J33: 6.9583333333333335E-4 | K33: 5.836805555555556E-4
A34: 33 | B34: 5.8101851851851858E-4 | C34: 5.6886574074074066E-4 | D34: 5.8298611111111105E-4 | E34: 5.2696759259259266E-4 | F34: 5.0034722222222223E-4 | G34: 5.6412037037037032E-4 | H34: 6.2384259259259261E-4 | I34: 6.140046296296296E-4 | J34: 7.7314814814814813E-4 | K34: 6.1805555555555561E-4
A35: 34 | B35: 5.7847222222222219E-4 | C35: 5.7314814814814815E-4 | D35: 5.9849537037037044E-4 | E35: 5.2858796296296302E-4 | F35: 4.9965277777777779E-4 | G35: 5.4988425925925918E-4 | H35: 6.1805555555555561E-4 | I35: 6.1805555555555561E-4 | J35: 7.2731481481481486E-4 | K35: 6.0625000000000002E-4
A36: 35 | B36: 5.8101851851851858E-4 | C36: 5.6655092592592597E-4 | D36: 5.9490740740740739E-4 | E36: 5.311342592592593E-4 | F36: 5.1111111111111116E-4 | G36: 5.6550925925925931E-4 | H36: 6.0694444444444446E-4 | I36: 6.0694444444444446E-4 | J36: 6.9675925925925938E-4 | K36: 6.0231481481481475E-4
A37: 36 | B37: 5.7812499999999997E-4 | C37: 5.5844907407407416E-4 | D37: 5.912037037037037E-4 | E37: 5.2395833333333342E-4 | F37: 5.0150462962962963E-4 | G37: 5.608796296296296E-4 | H37: 6.3923611111111115E-4 | I37: 6.128472222222222E-4 | J37: 6.8495370370370368E-4 | K37: 6.0891203703703704E-4
A38: 37 | B38: 5.9791666666666663E-4 | C38: 5.637731481481481E-4 | D38: 5.9814814814814811E-4 | E38: 5.2962962962962957E-4 | F38: 5.0694444444444441E-4 | G38: 5.5150462962962965E-4 | H38: 6.0150462962962968E-4 | I38: 6.105324074074074E-4 | J38: 7.620370370370372E-4 | K38: Å@
A39: 38 | B39: 5.8032407407407414E-4 | C39: 5.7824074074074071E-4 | D39: 5.8472222222222226E-4 | E39: 5.3287037037037029E-4 | F39: 5.0891203703703699E-4 | G39: 5.4398148148148144E-4 | H39: 6.0497685185185188E-4 | I39: 6.2187499999999992E-4 | J39: 7.8854166666666667E-4 | K39: Å@
A40: 39 | B40: 6.0486111111111114E-4 | C40: 5.6759259259259263E-4 | D40: 5.6481481481481476E-4 | E40: 5.2280092592592591E-4 | F40: 4.9525462962962956E-4 | G40: 5.5081018518518521E-4 | H40: 5.9942129629629625E-4 | I40: 6.3171296296296294E-4 | J40: 7.0023148148148147E-4 | K40: Å@
A41: 40 | B41: 5.6493055555555561E-4 | C41: 5.5092592592592595E-4 | D41: 5.4351851851851859E-4 | E41: 4.9224537037037043E-4 | F41: 4.5960648148148147E-4 | G41: 5.0740740740740748E-4 | H41: 5.3530092592592594E-4 | I41: 6.0162037037037031E-4 | J41: 6.6828703703703711E-4 | K41: Å@
A42: Å@ | B42: Å@ | C42: Å@ | D42: Å@ | E42: Å@ | F42: Å@ | G42: Å@ | H42: Å@ | I42: Å@ | J42: Å@ | K42: Å@
A43: Fastest | B43: =MIN(B2:B41) -> 5.0034722222222223E-4 | C43: =MIN(C2:C41) -> 5.3969907407407406E-4 | D43: =MIN(D2:D41) -> 5.0289351851851851E-4 | E43: =MIN(E2:E41) -> 4.9224537037037043E-4 | F43: =MIN(F2:F41) -> 4.3043981481481487E-4 | G43: =MIN(G2:G41) -> 5.0740740740740748E-4 | H43: =MIN(H2:H41) -> 5.3171296296296289E-4 | I43: =MIN(I2:I41) -> 4.9849537037037039E-4 | J43: =MIN(J2:J41) -> 5.4583333333333328E-4 | K43: =MIN(K2:K41) -> 4.9189814814814821E-4
A44: Slowest | B44: =MAX(B2:B41) -> 6.0486111111111114E-4 | C44: =MAX(C2:C41) -> 5.8379629629629634E-4 | D44: =MAX(D2:D41) -> 5.9849537037037044E-4 | E44: =MAX(E2:E41) -> 5.6180555555555552E-4 | F44: =MAX(F2:F41) -> 5.1145833333333327E-4 | G44: =MAX(G2:G41) -> 6.5254629629629636E-4 | H44: =MAX(H2:H41) -> 6.3923611111111115E-4 | I44: =MAX(I2:I41) -> 6.8900462962962958E-4 | J44: =MAX(J2:J41) -> 7.8854166666666667E-4 | K44: =MAX(K2:K41) -> 6.2268518518518521E-4
A45: Å@ | B45: Å@ | C45: Å@ | D45: Å@ | E45: Å@ | F45: Å@ | G45: Å@ | H45: Å@ | I45: Å@ | J45: Å@ | K45: Å@
A46: Sum | B46: =SUM(B2:B41) -> 2.2072106481481481E-2 | C46: =SUM(C2:C41) -> 2.2495486111111108E-2 | D46: =SUM(D2:D41) -> 2.2301157407407415E-2 | E46: =SUM(E2:E41) -> 2.151354166666667E-2 | F46: =SUM(F2:F41) -> 1.8827893518518518E-2 | G46: =SUM(G2:G41) -> 2.3102199074074081E-2 | H46: =SUM(H2:H41) -> 2.443483796296296E-2 | I46: =SUM(I2:I41) -> 2.4753009259259266E-2 | J46: =SUM(J2:J41) -> 2.6422569444444446E-2 | K46: =SUM(K2:K41) -> 1.4810763888888889E-2
A47: Sum-Fast&Slow | B47: =SUM(B2:B41)-B44-B43 -> 2.0966898148148148E-2 | C47: =SUM(C2:C41)-C44-C43 -> 2.1371990740740737E-2 | D47: =SUM(D2:D41)-D44-D43 -> 2.1199768518518528E-2 | E47: =SUM(E2:E41)-E44-E43 -> 2.0459490740740743E-2 | F47: =SUM(F2:F41)-F44-F43 -> 1.7885995370370372E-2 | G47: =SUM(G2:G41)-G44-G43 -> 2.1942245370370376E-2 | H47: =SUM(H2:H41)-H44-H43 -> 2.3263888888888886E-2 | I47: =SUM(I2:I41)-I44-I43 -> 2.3565509259259265E-2 | J47: =SUM(J2:J41)-J44-J43 -> 2.5088194444444448E-2 | K47: =SUM(K2:K41)-K44-K43 -> 1.3696180555555557E-2
A48: Å@ | B48: Å@ | C48: Å@ | D48: Å@ | E48: Å@ | F48: Å@ | G48: Å@ | H48: Å@ | I48: Å@ | J48: Å@ | K48: Å@
A49: Ave(Non include Fast & SlowÅj | B49: =B47/37 -> 5.6667292292292293E-4 | C49: =C47/38 -> 5.6242080896686149E-4 | D49: =D47/38 -> 5.5788864522417182E-4 | E49: =E47/38 -> 5.3840765107212479E-4 | F49: =F47/38 -> 4.7068408869395715E-4 | G49: =G47/38 -> 5.7742750974658884E-4 | H49: =H47/38 -> 6.1220760233918117E-4 | I49: =I47/38 -> 6.2014498050682275E-4 | J49: =J47/38 -> 6.6021564327485387E-4 | K49: =K47/23 -> 5.9548611111111119E-4